<?xml version="1.0" encoding="UTF-8"?>
<list xmlns:xsi="http://www.w3.org/2001/XMLSchema-instance" xsi:noNamespaceSchemaLocation="../xsd/multisell.xsd">
	<npcs>
		<npc>31827</npc> <!-- Adventure Guildsman -->
		<npc>31828</npc> <!-- Adventure Guildsman -->
		<npc>31829</npc> <!-- Adventure Guildsman -->
		<npc>31830</npc> <!-- Adventure Guildsman -->
		<npc>31831</npc> <!-- Adventure Guildsman -->
	</npcs>
	<item>
		<!-- Memento Mori -->
		<ingredient count="204" id="9814" />
		<!-- Dragon Heart -->
		<ingredient count="56" id="9815" />
		<!-- Earth Egg -->
		<ingredient count="224" id="9816" />
		<!-- Nonliving Nucleus -->
		<ingredient count="112" id="9817" />
		<!-- Crystal Staff -->
		<production count="1" id="192" />
	</item>
	<item>
		<!-- Memento Mori -->
		<ingredient count="256" id="9814" />
		<!-- Dragon Heart -->
		<ingredient count="70" id="9815" />
		<!-- Earth Egg -->
		<ingredient count="280" id="9816" />
		<!-- Nonliving Nucleus -->
		<ingredient count="140" id="9817" />
		<!-- Cursed Staff -->
		<production count="1" id="195" />
	</item>
	<item>
		<!-- Memento Mori -->
		<ingredient count="414" id="9814" />
		<!-- Dragon Heart -->
		<ingredient count="112" id="9815" />
		<!-- Earth Egg -->
		<ingredient count="452" id="9816" />
		<!-- Nonliving Nucleus -->
		<ingredient count="226" id="9817" />
		<!-- Stick of Eternity -->
		<production count="1" id="196" />
	</item>
	<item>
		<!-- Memento Mori -->
		<ingredient count="590" id="9814" />
		<!-- Dragon Heart -->
		<ingredient count="160" id="9815" />
		<!-- Earth Egg -->
		<ingredient count="644" id="9816" />
		<!-- Nonliving Nucleus -->
		<ingredient count="322" id="9817" />
		<!-- Ghoul's Staff -->
		<production count="1" id="205" />
	</item>
	<item>
		<!-- Memento Mori -->
		<ingredient count="590" id="9814" />
		<!-- Dragon Heart -->
		<ingredient count="160" id="9815" />
		<!-- Earth Egg -->
		<ingredient count="644" id="9816" />
		<!-- Nonliving Nucleus -->
		<ingredient count="322" id="9817" />
		<!-- Ecliptic Axe -->
		<production count="1" id="7891" />
	</item>
	<item>
		<!-- Memento Mori -->
		<ingredient count="772" id="9814" />
		<!-- Dragon Heart -->
		<ingredient count="232" id="9815" />
		<!-- Earth Egg -->
		<ingredient count="772" id="9816" />
		<!-- Nonliving Nucleus -->
		<ingredient count="540" id="9817" />
		<!-- Angelic Essence -->
		<ingredient count="464" id="9818" />
		<!-- Sprite's Staff -->
		<production count="1" id="92" />
	</item>
	<item>
		<!-- Memento Mori -->
		<ingredient count="772" id="9814" />
		<!-- Dragon Heart -->
		<ingredient count="232" id="9815" />
		<!-- Earth Egg -->
		<ingredient count="772" id="9816" />
		<!-- Nonliving Nucleus -->
		<ingredient count="540" id="9817" />
		<!-- Angelic Essence -->
		<ingredient count="464" id="9818" />
		<!-- Spell Breaker -->
		<production count="1" id="7892" />
	</item>
	<item>
		<!-- Memento Mori -->
		<ingredient count="1236" id="9814" />
		<!-- Dragon Heart -->
		<ingredient count="372" id="9815" />
		<!-- Earth Egg -->
		<ingredient count="1236" id="9816" />
		<!-- Nonliving Nucleus -->
		<ingredient count="864" id="9817" />
		<!-- Angelic Essence -->
		<ingredient count="744" id="9818" />
		<!-- Staff of Evil Spirits -->
		<production count="1" id="210" />
	</item>
	<item>
		<!-- Memento Mori -->
		<ingredient count="1236" id="9814" />
		<!-- Dragon Heart -->
		<ingredient count="372" id="9815" />
		<!-- Earth Egg -->
		<ingredient count="1236" id="9816" />
		<!-- Nonliving Nucleus -->
		<ingredient count="864" id="9817" />
		<!-- Angelic Essence -->
		<ingredient count="744" id="9818" />
		<!-- Kaim Vanul's Bones -->
		<production count="1" id="7893" />
	</item>
	<item>
		<!-- Memento Mori -->
		<ingredient count="14" id="9814" />
		<!-- Earth Egg -->
		<ingredient count="14" id="9816" />
		<!-- Angelic Essence -->
		<ingredient count="2" id="9818" />
		<!-- Chain Boots -->
		<production count="1" id="2429" />
	</item>
	<item>
		<!-- Memento Mori -->
		<ingredient count="14" id="9814" />
		<!-- Earth Egg -->
		<ingredient count="14" id="9816" />
		<!-- Angelic Essence -->
		<ingredient count="2" id="9818" />
		<!-- Reinforced Mithril Boots -->
		<production count="1" id="62" />
	</item>
	<item>
		<!-- Memento Mori -->
		<ingredient count="14" id="9814" />
		<!-- Earth Egg -->
		<ingredient count="14" id="9816" />
		<!-- Angelic Essence -->
		<ingredient count="2" id="9818" />
		<!-- Karmian Boots -->
		<production count="1" id="2430" />
	</item>
	<item>
		<!-- Memento Mori -->
		<ingredient count="14" id="9814" />
		<!-- Earth Egg -->
		<ingredient count="14" id="9816" />
		<!-- Angelic Essence -->
		<ingredient count="2" id="9818" />
		<!-- Dwarven Chain Boots -->
		<production count="1" id="2432" />
	</item>
	<item>
		<!-- Memento Mori -->
		<ingredient count="14" id="9814" />
		<!-- Earth Egg -->
		<ingredient count="14" id="9816" />
		<!-- Angelic Essence -->
		<ingredient count="2" id="9818" />
		<!-- Boots of Seal -->
		<production count="1" id="2433" />
	</item>
	<item>
		<!-- Memento Mori -->
		<ingredient count="18" id="9814" />
		<!-- Earth Egg -->
		<ingredient count="18" id="9816" />
		<!-- Angelic Essence -->
		<ingredient count="4" id="9818" />
		<!-- Rind Leather Boots -->
		<production count="1" id="2434" />
	</item>
	<item>
		<!-- Memento Mori -->
		<ingredient count="28" id="9814" />
		<!-- Earth Egg -->
		<ingredient count="30" id="9816" />
		<!-- Angelic Essence -->
		<ingredient count="6" id="9818" />
		<!-- Composite Boots -->
		<production count="1" id="64" />
	</item>
	<item>
		<!-- Memento Mori -->
		<ingredient count="32" id="9814" />
		<!-- Earth Egg -->
		<ingredient count="34" id="9816" />
		<!-- Angelic Essence -->
		<ingredient count="6" id="9818" />
		<!-- Theca Leather Boots -->
		<production count="1" id="2436" />
	</item>
	<item>
		<!-- Memento Mori -->
		<ingredient count="40" id="9814" />
		<!-- Earth Egg -->
		<ingredient count="44" id="9816" />
		<!-- Angelic Essence -->
		<ingredient count="8" id="9818" />
		<!-- Full Plate Boots -->
		<production count="1" id="2438" />
	</item>
	<item>
		<!-- Memento Mori -->
		<ingredient count="40" id="9814" />
		<!-- Earth Egg -->
		<ingredient count="44" id="9816" />
		<!-- Angelic Essence -->
		<ingredient count="8" id="9818" />
		<!-- Drake Leather Boots -->
		<production count="1" id="2437" />
	</item>
	<item>
		<!-- Memento Mori -->
		<ingredient count="4" id="9814" />
		<!-- Dragon Heart -->
		<ingredient count="4" id="9815" />
		<!-- Earth Egg -->
		<ingredient count="4" id="9816" />
		<!-- Nonliving Nucleus -->
		<ingredient count="4" id="9817" />
		<!-- Angelic Essence -->
		<ingredient count="4" id="9818" />
		<!-- Adena -->
		<ingredient count="600000" id="57" />
		<!-- Transformation Sealbook: Dragon Bomber -->
		<production count="1" id="9655" />
	</item>
</list>