<?xml version='1.0' encoding='utf-8'?>

<!-- S-84 Weapon -->


<list maintainEnchantment="true"
	xmlns:xsi="http://www.w3.org/2001/XMLSchema-instance"
	xsi:noNamespaceSchemaLocation="../../xsd/multisell.xsd">

	<!-- Vesper Avenger - Health -->
	<item>
		<ingredient id="40000" count="20" />
		<production id="14137" count="1" enchantmentLevel="25" />
	</item>

	<!-- Vesper Avenger - HP Drain -->
	<item>
		<ingredient id="40000" count="20" />
		<production id="14136" count="1" enchantmentLevel="25" />
	</item>

	<!-- Vesper Avenger - HP Regeneration -->
	<item>
		<ingredient id="40000" count="20" />
		<production id="14138" count="1" enchantmentLevel="25" />
	</item>

	<!-- Vesper Buster - Acumen -->
	<item>
		<ingredient id="40000" count="20" />
		<production id="14125" count="1" enchantmentLevel="25" />
	</item>

	<!-- Vesper Buster - Magic Hold -->
	<item>
		<ingredient id="40000" count="20" />
		<production id="14126" count="1" enchantmentLevel="25" />
	</item>

	<!-- Vesper Buster - Mana Up -->
	<item>
		<ingredient id="40000" count="20" />
		<production id="14124" count="1" enchantmentLevel="25" />
	</item>

	<!-- Vesper Caster -->
	<item>
		<ingredient id="40000" count="20" />
		<production id="14142" count="1" enchantmentLevel="25" />
	</item>

	<!-- Vesper Caster - Mana Up -->
	<item>
		<ingredient id="40000" count="20" />
		<production id="14144" count="1" enchantmentLevel="25" />
	</item>

	<!-- Vesper Caster - MP Regeneration -->
	<item>
		<ingredient id="40000" count="20" />
		<production id="14143" count="1" enchantmentLevel="25" />
	</item>

	<!-- Vesper Cutter -->
	<item>
		<ingredient id="40000" count="20" />
		<production id="14120" count="1" enchantmentLevel="25" />
	</item>

	<!-- Vesper Cutter - Haste -->
	<item>
		<ingredient id="40000" count="20" />
		<production id="14118" count="1" enchantmentLevel="25" />
	</item>

	<!-- Vesper Cutter - Health -->
	<item>
		<ingredient id="40000" count="20" />
		<production id="14119" count="1" enchantmentLevel="25" />
	</item>

	<!-- Vesper Fighter - Critical Stun -->
	<item>
		<ingredient id="40000" count="20" />
		<production id="14132" count="1" enchantmentLevel="25" />
	</item>

	<!-- Vesper Fighter - Focus -->
	<item>
		<ingredient id="40000" count="20" />
		<production id="14130" count="1" enchantmentLevel="25" />
	</item>

	<!-- Vesper Fighter - Health -->
	<item>
		<ingredient id="40000" count="20" />
		<production id="14131" count="1" enchantmentLevel="25" />
	</item>

	<!-- Vesper Nagan - Focus -->
	<item>
		<ingredient id="40000" count="20" />
		<production id="14159" count="1" enchantmentLevel="25" />
	</item>

	<!-- Vesper Nagan - Health -->
	<item>
		<ingredient id="40000" count="20" />
		<production id="14158" count="1" enchantmentLevel="25" />
	</item>

	<!-- Vesper Nagan - Haste -->
	<item>
		<ingredient id="40000" count="20" />
		<production id="14157" count="1" enchantmentLevel="25" />
	</item>

	<!-- Vesper Pincer - Focus -->
	<item>
		<ingredient id="40000" count="20" />
		<production id="14153" count="1" enchantmentLevel="25" />
	</item>

	<!-- Vesper Pincer - Haste -->
	<item>
		<ingredient id="40000" count="20" />
		<production id="14151" count="1" enchantmentLevel="25" />
	</item>

	<!-- Vesper Pincer - Health -->
	<item>
		<ingredient id="40000" count="20" />
		<production id="14152" count="1" enchantmentLevel="25" />
	</item>

	<!-- Vesper Retributer - Health -->
	<item>
		<ingredient id="40000" count="20" />
		<production id="14140" count="1" enchantmentLevel="25" />
	</item>

	<!-- Vesper Retributer - HP Drain -->
	<item>
		<ingredient id="40000" count="20" />
		<production id="14141" count="1" enchantmentLevel="25" />
	</item>

	<!-- Vesper Retributer - HP Regeneration -->
	<item>
		<ingredient id="40000" count="20" />
		<production id="14139" count="1" enchantmentLevel="25" />
	</item>

	<!-- Vesper Shaper - Critical Damage -->
	<item>
		<ingredient id="40000" count="20" />
		<production id="14127" count="1" enchantmentLevel="25" />
	</item>

	<!-- Vesper Shaper - HP Drain -->
	<item>
		<ingredient id="40000" count="20" />
		<production id="14128" count="1" enchantmentLevel="25" />
	</item>

	<!-- Vesper Shaper - Haste -->
	<item>
		<ingredient id="40000" count="20" />
		<production id="14129" count="1" enchantmentLevel="25" />
	</item>

	<!-- Vesper Sheutjeh - Cheap Shot -->
	<item>
		<ingredient id="40000" count="20" />
		<production id="14154" count="1" enchantmentLevel="25" />
	</item>

	<!-- Vesper Sheutjeh - Critical Slow -->
	<item>
		<ingredient id="40000" count="20" />
		<production id="14156" count="1" enchantmentLevel="25" />
	</item>

	<!-- Vesper Sheutjeh - Focus -->
	<item>
		<ingredient id="40000" count="20" />
		<production id="14155" count="1" enchantmentLevel="25" />
	</item>

	<!-- Vesper Singer - Empower -->
	<item>
		<ingredient id="40000" count="20" />
		<production id="14145" count="1" enchantmentLevel="25" />
	</item>

	<!-- Vesper Singer - Magic Hold -->
	<item>
		<ingredient id="40000" count="20" />
		<production id="14147" count="1" enchantmentLevel="25" />
	</item>

	<!-- Vesper Singer - MP Regeneration -->
	<item>
		<ingredient id="40000" count="20" />
		<production id="14146" count="1" enchantmentLevel="25" />
	</item>

	<!-- Vesper Slasher - Focus -->
	<item>
		<ingredient id="40000" count="20" />
		<production id="14123" count="1" enchantmentLevel="25" />
	</item>

	<!-- Vesper Slasher - Haste -->
	<item>
		<ingredient id="40000" count="20" />
		<production id="14121" count="1" enchantmentLevel="25" />
	</item>

	<!-- Vesper Slasher - Health -->
	<item>
		<ingredient id="40000" count="20" />
		<production id="14122" count="1" enchantmentLevel="25" />
	</item>

	<!-- Vesper Stormer - Guidance -->
	<item>
		<ingredient id="40000" count="20" />
		<production id="14134" count="1" enchantmentLevel="25" />
	</item>

	<!-- Vesper Stormer - Haste -->
	<item>
		<ingredient id="40000" count="20" />
		<production id="14135" count="1" enchantmentLevel="25" />
	</item>

	<!-- Vesper Stormer - Health -->
	<item>
		<ingredient id="40000" count="20" />
		<production id="14133" count="1" enchantmentLevel="25" />
	</item>

	<!-- Vesper Thrower - Cheap Shot -->
	<item>
		<ingredient id="40000" count="20" />
		<production id="14148" count="1" enchantmentLevel="25" />
	</item>

	<!-- Vesper Thrower - Focus -->
	<item>
		<ingredient id="40000" count="20" />
		<production id="14149" count="1" enchantmentLevel="25" />
	</item>

	<!-- Vesper Thrower - Critical Slow -->
	<item>
		<ingredient id="40000" count="20" />
		<production id="14150" count="1" enchantmentLevel="25" />
	</item>

	<!-- vesper dual sword -->
	<item>
		<ingredient id="40000" count="20" />
		<production id="52" count="1" enchantmentLevel="25" />
	</item>
	<!-- vesper dual dagger -->
	<item>
		<ingredient id="40000" count="20" />
		<production id="13884" count="1" enchantmentLevel="25" />
	</item>

</list>
